{
  "schema_version": "1.0",
  "request_id": "PREQ-0092-SELF-IMPLEMENT-001",
  "candidate_version": "0.09.2",
  "prompt_kind": "implementation",
  "compiled_task_graph": {
    "schema_version": "1.0",
    "project_id": "TCP-0092-SELF",
    "status": "compiled",
    "tasks": [
      {
        "task_id": "CTASK-0092-SELF-01",
        "source_task_id": "TASK-0092-SELF-01",
        "source_requirement_ids": [
          "REQ-0092-001",
          "REQ-0092-002"
        ],
        "write_scopes": [
          "src/spec_creator/prompt_compiler.py"
        ],
        "read_scopes": [
          "versions/v0.09.2/EVALUATION-PLAN.json",
          "versions/v0.09.2/FROZEN-RELEASE-CONTRACT.json"
        ],
        "produced_artifacts": [
          "artifact:v0092-self-01"
        ],
        "consumed_artifacts": [],
        "prerequisite_task_ids": [],
        "verification_refs": [
          "TEST-0092-SELF-01"
        ],
        "gate_ids": [
          "GATE-009-COMPILE"
        ],
        "conflict_zone_ids": [
          "CZ-001"
        ],
        "parallel_with": [],
        "complexity_score": 9,
        "complexity_factors": {
          "source_requirement_count": 2,
          "write_scope_count": 1,
          "prerequisite_count": 0,
          "verification_reference_count": 1
        },
        "provenance": {
          "source_requirement_ids": [
            "trace:REQ-0092-001:realized_by:FEAT-0092-SELF-01:decomposed_to:TASK-0092-SELF-01",
            "trace:REQ-0092-002:realized_by:FEAT-0092-SELF-01:decomposed_to:TASK-0092-SELF-01"
          ],
          "write_scopes": [
            "task_metadata:TASK-0092-SELF-01.write_scopes"
          ],
          "read_scopes": [
            "task_metadata:TASK-0092-SELF-01.read_scopes"
          ],
          "produced_artifacts": [
            "task_metadata:TASK-0092-SELF-01.produces_artifacts"
          ],
          "consumed_artifacts": [
            "task_metadata:TASK-0092-SELF-01.consumes_artifacts"
          ],
          "prerequisite_task_ids": [],
          "verification_refs": [
            "trace:TASK-0092-SELF-01:verified_by:TEST-0092-SELF-01"
          ],
          "gate_ids": [
            "trace:TEST-0092-SELF-01:gated_by:GATE-009-COMPILE"
          ],
          "conflict_zone_ids": [
            "write_scope:src/spec_creator/prompt_compiler.py"
          ],
          "parallel_with": [
            "rule:no_dependency_path_and_no_shared_write_scope"
          ],
          "complexity_score": [
            "formula:v0.08"
          ]
        }
      },
      {
        "task_id": "CTASK-0092-SELF-02",
        "source_task_id": "TASK-0092-SELF-02",
        "source_requirement_ids": [
          "REQ-0092-003",
          "REQ-0092-004"
        ],
        "write_scopes": [
          "src/spec_creator/prompt_compiler.py"
        ],
        "read_scopes": [
          "versions/v0.09.2/EVALUATION-PLAN.json",
          "versions/v0.09.2/FROZEN-RELEASE-CONTRACT.json"
        ],
        "produced_artifacts": [
          "artifact:v0092-self-02"
        ],
        "consumed_artifacts": [],
        "prerequisite_task_ids": [
          "CTASK-0092-SELF-01"
        ],
        "verification_refs": [
          "TEST-0092-SELF-02"
        ],
        "gate_ids": [
          "GATE-009-SCOPE"
        ],
        "conflict_zone_ids": [
          "CZ-001"
        ],
        "parallel_with": [],
        "complexity_score": 10,
        "complexity_factors": {
          "source_requirement_count": 2,
          "write_scope_count": 1,
          "prerequisite_count": 1,
          "verification_reference_count": 1
        },
        "provenance": {
          "source_requirement_ids": [
            "trace:REQ-0092-003:realized_by:FEAT-0092-SELF-02:decomposed_to:TASK-0092-SELF-02",
            "trace:REQ-0092-004:realized_by:FEAT-0092-SELF-02:decomposed_to:TASK-0092-SELF-02"
          ],
          "write_scopes": [
            "task_metadata:TASK-0092-SELF-02.write_scopes"
          ],
          "read_scopes": [
            "task_metadata:TASK-0092-SELF-02.read_scopes"
          ],
          "produced_artifacts": [
            "task_metadata:TASK-0092-SELF-02.produces_artifacts"
          ],
          "consumed_artifacts": [
            "task_metadata:TASK-0092-SELF-02.consumes_artifacts"
          ],
          "prerequisite_task_ids": [
            "trace:TASK-0092-SELF-01:precedes:TASK-0092-SELF-02"
          ],
          "verification_refs": [
            "trace:TASK-0092-SELF-02:verified_by:TEST-0092-SELF-02"
          ],
          "gate_ids": [
            "trace:TEST-0092-SELF-02:gated_by:GATE-009-SCOPE"
          ],
          "conflict_zone_ids": [
            "write_scope:src/spec_creator/prompt_compiler.py"
          ],
          "parallel_with": [
            "rule:no_dependency_path_and_no_shared_write_scope"
          ],
          "complexity_score": [
            "formula:v0.08"
          ]
        }
      },
      {
        "task_id": "CTASK-0092-SELF-03",
        "source_task_id": "TASK-0092-SELF-03",
        "source_requirement_ids": [
          "REQ-0092-005",
          "REQ-0092-006"
        ],
        "write_scopes": [
          "src/spec_creator/prompt_compiler.py"
        ],
        "read_scopes": [
          "versions/v0.09.2/EVALUATION-PLAN.json",
          "versions/v0.09.2/FROZEN-RELEASE-CONTRACT.json"
        ],
        "produced_artifacts": [
          "artifact:v0092-self-03"
        ],
        "consumed_artifacts": [],
        "prerequisite_task_ids": [
          "CTASK-0092-SELF-02"
        ],
        "verification_refs": [
          "TEST-0092-SELF-03"
        ],
        "gate_ids": [
          "GATE-009-PREREQUISITE"
        ],
        "conflict_zone_ids": [
          "CZ-001"
        ],
        "parallel_with": [],
        "complexity_score": 10,
        "complexity_factors": {
          "source_requirement_count": 2,
          "write_scope_count": 1,
          "prerequisite_count": 1,
          "verification_reference_count": 1
        },
        "provenance": {
          "source_requirement_ids": [
            "trace:REQ-0092-005:realized_by:FEAT-0092-SELF-03:decomposed_to:TASK-0092-SELF-03",
            "trace:REQ-0092-006:realized_by:FEAT-0092-SELF-03:decomposed_to:TASK-0092-SELF-03"
          ],
          "write_scopes": [
            "task_metadata:TASK-0092-SELF-03.write_scopes"
          ],
          "read_scopes": [
            "task_metadata:TASK-0092-SELF-03.read_scopes"
          ],
          "produced_artifacts": [
            "task_metadata:TASK-0092-SELF-03.produces_artifacts"
          ],
          "consumed_artifacts": [
            "task_metadata:TASK-0092-SELF-03.consumes_artifacts"
          ],
          "prerequisite_task_ids": [
            "trace:TASK-0092-SELF-02:precedes:TASK-0092-SELF-03"
          ],
          "verification_refs": [
            "trace:TASK-0092-SELF-03:verified_by:TEST-0092-SELF-03"
          ],
          "gate_ids": [
            "trace:TEST-0092-SELF-03:gated_by:GATE-009-PREREQUISITE"
          ],
          "conflict_zone_ids": [
            "write_scope:src/spec_creator/prompt_compiler.py"
          ],
          "parallel_with": [
            "rule:no_dependency_path_and_no_shared_write_scope"
          ],
          "complexity_score": [
            "formula:v0.08"
          ]
        }
      },
      {
        "task_id": "CTASK-0092-SELF-04",
        "source_task_id": "TASK-0092-SELF-04",
        "source_requirement_ids": [
          "REQ-0092-007",
          "REQ-0092-008"
        ],
        "write_scopes": [
          "src/spec_creator/prompt_compiler.py"
        ],
        "read_scopes": [
          "versions/v0.09.2/EVALUATION-PLAN.json",
          "versions/v0.09.2/FROZEN-RELEASE-CONTRACT.json"
        ],
        "produced_artifacts": [
          "artifact:v0092-self-04"
        ],
        "consumed_artifacts": [],
        "prerequisite_task_ids": [
          "CTASK-0092-SELF-03"
        ],
        "verification_refs": [
          "TEST-0092-SELF-04"
        ],
        "gate_ids": [
          "GATE-009-VERIFIER"
        ],
        "conflict_zone_ids": [
          "CZ-001"
        ],
        "parallel_with": [],
        "complexity_score": 10,
        "complexity_factors": {
          "source_requirement_count": 2,
          "write_scope_count": 1,
          "prerequisite_count": 1,
          "verification_reference_count": 1
        },
        "provenance": {
          "source_requirement_ids": [
            "trace:REQ-0092-007:realized_by:FEAT-0092-SELF-04:decomposed_to:TASK-0092-SELF-04",
            "trace:REQ-0092-008:realized_by:FEAT-0092-SELF-04:decomposed_to:TASK-0092-SELF-04"
          ],
          "write_scopes": [
            "task_metadata:TASK-0092-SELF-04.write_scopes"
          ],
          "read_scopes": [
            "task_metadata:TASK-0092-SELF-04.read_scopes"
          ],
          "produced_artifacts": [
            "task_metadata:TASK-0092-SELF-04.produces_artifacts"
          ],
          "consumed_artifacts": [
            "task_metadata:TASK-0092-SELF-04.consumes_artifacts"
          ],
          "prerequisite_task_ids": [
            "trace:TASK-0092-SELF-03:precedes:TASK-0092-SELF-04"
          ],
          "verification_refs": [
            "trace:TASK-0092-SELF-04:verified_by:TEST-0092-SELF-04"
          ],
          "gate_ids": [
            "trace:TEST-0092-SELF-04:gated_by:GATE-009-VERIFIER"
          ],
          "conflict_zone_ids": [
            "write_scope:src/spec_creator/prompt_compiler.py"
          ],
          "parallel_with": [
            "rule:no_dependency_path_and_no_shared_write_scope"
          ],
          "complexity_score": [
            "formula:v0.08"
          ]
        }
      },
      {
        "task_id": "CTASK-0092-SELF-05",
        "source_task_id": "TASK-0092-SELF-05",
        "source_requirement_ids": [
          "REQ-0092-009",
          "REQ-0092-010"
        ],
        "write_scopes": [
          "src/spec_creator/prompt_compiler.py"